{
  "sha256": "7a14ce86c6486018bc8be9060a043024c1d4ef9081e4f1f2d21692602aa7d394",
  "source_url": "https://github.com/Yuan-ManX/ai-game-devtools/blob/HEAD/README.md",
  "fetched_at": "2026-06-10T03:15:05Z",
  "fetcher": "smadp.autopilot.profile_enrich.v1",
  "media_type": "text/markdown",
  "quote": "kens.                               |[arXiv](https://arxiv.org/abs/2402.16819)  |              |   Tool   |\n| [NExT-GPT](https://github.com/NExT-GPT/NExT-GPT)                                               | Any-to-Any Multimodal Large Language Model.                                                                                                                                                    |          |              |   Tool   |\n| [OLMo](https://github.com/allenai/OLMo)                                                        | Open Language Model                                                                                                              |[arXiv](https://arxiv.org/abs/2402.00838)  |             |   Tool   |\n| [OmniLMM](https://github.com/OpenBMB/OmniLMM)                                                  | Large multi-modal models for strong performance and efficient deployment.                                                                                                                      |          |              |   Tool   |\n| [OneLLM](https://github.com/csuhan/OneLLM)                                                     | One Framework to Align All Modalities with Language.                                                                            |[arXiv](https://arxiv.org/abs/2312.03700)  |              |   Tool   |\n| [Open-Assistant](https://github.com/LAION-AI/Open-Assistant)                                   | OpenAssistant is a chat-based assistant that understands tasks, can interact with third-party systems, and retrieve information dynamically to do so.                                        |          |              |   Tool   |\n| [Open Deep Research](https://github.com/dzhng/deep-research)                                   | An AI-powered research assistant that performs iterative, deep research on any topic by combining search engines, web scraping, and large language models.                                   |          |              |   LLM   |\n| [OpenDevin](https://github.com/OpenDevin/OpenDevin)                                            | An autonomous AI software engineer.                                                                                                                                                            |          |              |   Tool   |\n| [Orion-14B](https://github.com/OrionStarAI/Orion)                                              | Orion-14B is a family of models includes a 14B foundation LLM, and a series of models.                                          |[arXiv](https://arxiv.org/abs/2401.12246)  |              |   Tool   |\n| [Panda](https://github.com/dandelionsllm/pandallm)                                             | Overseas Chinese open source large language model, based on Llama-7B, -13B, -33B, -65B for continuous pre-training in the Chinese field.                                                    |          |              |   Tool   |\n| [Perplexica](https://github.com/ItzCrazyKns/Perplexica)                                        | An AI-powered search engine.                                                                                                                                                                   |           |             |   Tool   |\n| [Pi](https://heypi.com/talk)                                                                   | AI chatbot designed for personal assistance and emotional support.                                                                                                                             |          |              |   Tool   |\n| [Qwen1.5](https://github.com/QwenLM/Qwen1.5)                                                   | Qwen1.5 is the improved version of Qwen.                                                                                                                                                       |           |             |   Tool   |\n| [Qwen2](https://github.com/QwenLM/Qwen2)                                                       | Qwen2 is the large language model series developed by Qwen team, Alibaba Cloud.                                                                                                                |           |             |   LLM   |\n| [Qwen2.5-Coder](https://github.com/QwenLM/Qwen2.5-Coder)                                       | Qwen2.5-Coder is the code version of Qwen2.5, the large language model series developed by Qwen team, Alibaba Cloud.                         |[arXiv](https://arxiv.org/abs/2409.12186)  |             |   LLM   |\n| [Qwen-7B](https://github.com/QwenLM/Qwen-7B)                                                   | The official repo of Qwen-7B (\u901a\u4e49\u5343\u95ee-7B) chat & pretrained large language model proposed by Alibaba Cloud.                                                                                    |          |              |   LLM   |\n| [Qwen3](https://github.com/QwenLM/Qwen3)                                                       | Qwen3 is the large language model series developed by Qwen team, Alibaba Cloud.                                                                |[arXiv](https://arxiv.org/abs/2505.09388)  |              |   LLM   |\n| [RepoAgent](https://github.com/OpenBMB/RepoAgent)                                              | RepoAgent is an Open-Source project driven by Large Language Models(LLMs) that aims to provide an intelligent way to document projects.     |[arXiv](https://arxiv.org/abs/2402.16667)  |              |   Tool   |\n| [s1](https://github.com/simplescaling/s1)                                                      | s1: Simple test-time scaling.                                                                                                                  |[arXiv](https://arxiv.org/abs/2501.19393)  |              |   LLM   |\n| [Sanity AI Engine](https://github.com/tosos/SanityEngine)                                      | Sanity AI Engine for the Unity Game Development Tool.                                                                                                                                          |          |     Unity     |   Tool   |\n| [SearchGPT](https://github.com/tobiasbueschel/search-gpt)                                      | \ud83c\udf33 Connecting ChatGPT with the Internet                                                                                                                                                       |          |              |   Tool   |\n| [Seed-OSS](https://github.com/ByteDance-Seed/seed-oss)                                         | Seed-OSS is a series of open-source large language models developed by ByteDance's Seed Team, designed for powerful long-context, reasoning, agent and general capabilities, and versatile developer-friendly features.                                                                                                                                                                   |          |              |   LLM   |\n| [ShareGPT4V](https://sharegpt4v.github.io/)                                                    | Improving Large Multi-Modal Models with Better Captions.                                                                                                                                       |          |              |   Tool   |\n| [SkyThought](https://github.com/NovaSky-AI/SkyThought)                                         | Sky-T1: Train your own O1 preview model within $450.                                                                                                                                           |          |              |   LLM   |\n| [Skywork](https://github.com/SkyworkAI/Skywork)                                                | Skywork series models are pre-trained on 3.2TB of high-quality multilingual (mainly Chinese and English) and code data.                                                                  |          |              |  ",
  "context": "README chunk 5"
}
