{
  "sha256": "fbb1eaee974a1c2cbd9336d0d45ceeeb07d01e5b6c01bf6620dcbcb0cf14d55e",
  "source_url": "https://github.com/sahat/hackathon-starter/blob/HEAD/README.md",
  "fetched_at": "2026-06-10T04:38:47Z",
  "fetcher": "smadp.autopilot.profile_enrich.v1",
  "media_type": "text/markdown",
  "quote": "end js)  |\n| **config**/flash.js              | Flash middleware (replacement for express-flash)                     |\n| **config**/morgan.js             | Configuration for request logging with morgan.                       |\n| **config**/nodemailer.js         | Configuration and helper function for sending email with nodemailer. |\n| **config**/passport.js           | Passport Local and OAuth strategies, plus login middleware.          |\n| **config**/token-revocation.js   | Helper for revoking OAuth tokens.                                    |\n| **controllers**/ai.js            | Controller for /ai route and all ai examples and boilerplates.       |\n| **controllers**/api.js           | Controller for /api route and all api examples.                      |\n| **controllers**/contact.js       | Controller for contact form.                                         |\n| **controllers**/home.js          | Controller for home page (index).                                    |\n| **controllers**/user.js          | Controller for user account management.                              |\n| **controllers**/webauthn.js      | Controller for webauthn management (passkey / biometrics login)      |\n| **models**/User.js               | Mongoose schema and model for User.                                  |\n| **public**/                      | Static assets (fonts, css, js, img).                                 |\n| **public**/**js**/application.js | Specify client-side JavaScript dependencies.                         |\n| **public**/**js**/app.js         | Place your client-side JavaScript here.                              |\n| **public**/**js**/theme.js       | Client-side dark mode toggle (localStorage persistence)              |\n| **public**/**css**/main.scss     | Main stylesheet for your app.                                        |\n| **test**/\\*.js                   | Tests, related configs and helpers.                                  |\n| **views/account**/               | Templates for _login, password reset, signup, profile, webauthn_     |\n| **views/ai**/                    | Templates for AI examples and boilerplates.                          |\n| **views/api**/                   | Templates for API examples.                                          |\n| **views/partials**/flash.pug     | Error, info and success flash notifications.                         |\n| **views/partials**/header.pug    | Navbar partial template.                                             |\n| **views/partials**/footer.pug    | Footer partial template.                                             |\n| **views**/layout.pug             | Base template.                                                       |\n| **views**/home.pug               | Home page template.                                                  |\n| .env.example                     | Your API keys, tokens, passwords and database URI.                   |\n| .gitignore                       | Folder and files ignored by git.                                     |\n| app.js                           | The main application file.                                           |\n| eslint.config.mjs                | Rules for eslint linter.                                             |\n| package.json                     | NPM dependencies.                                                    |\n| package-lock.json                | Contains exact versions of NPM dependencies in package.json.         |\n\n**Note:** There is no preference for how you name or structure your views.\nYou could place all your templates in a top-level `views` directory without\nhaving a nested folder structure if that makes things easier for you.\nJust don't forget to update `extends ../layout` and corresponding\n`res.render()` paths in controllers.\n\n## List of Packages\n\n**Dependencies**\n\nRequired to run the project before your modifications\n\n| Package                       | Description                                                           |\n| ----------------------------- | --------------------------------------------------------------------- |\n| @fortawesome/fontawesome-free | Symbol and Icon library.                                              |\n| @googleapis/drive             | Google Drive API integration library.                                 |\n| @googleapis/sheets            | Google Sheets API integration library.                                |\n| @huggingface/inference        | Client library for Hugging Face Inference providers                   |\n| @keyv/mongo                   | MongoDB storage adapter for Keyv                                      |\n| @langchain/core               | Base LangChain abstractions and Expression Language                   |\n| @langchain/mongodb            | MongoDB integrations for LangChain                                    |\n| @langchain/textsplitters      | LangChain text splitters for RAG pipelines                            |\n| @lob/lob-typescript-sdk       | Lob (USPS mailing / physical mailing service) library.                |\n| @node-rs/bcrypt               | Library for hashing and salting user passwords.                       |\n| @octokit/rest                 | GitHub API library.                                                   |\n| @passport-js/passport-twitter | X (Twitter) login support (OAuth 2).                                  |\n| @popperjs/core                | Frontend js library for poppers and tooltips.                         |\n| @simplewebauthn/browser       | WebAuthn frontend library (passkey / biometrics authentication)       |\n| @simplewebauthn/server        | WebAuthn backend library (passkey / biometrics authentication)        |\n| @zapier/secret-scrubber       | For redacting sensitive/secret values in objects                      |\n| bootstrap                     | CSS Framework.                                                        |\n| bootstrap-social              | Social buttons library.                                               |\n| bowser                        | User agent parser                                                     |\n| chart.js                      | Front-end js library for creating charts.                             |\n| cheerio                       | Scrape web pages using jQuery-style syntax.                           |\n| compression                   | Node.js compression middleware.                                       |\n| connect-mongo                 | MongoDB session store for Express.                                    |\n| errorhandler                  | Development-only error handler middleware.                            |\n| express                       | Node.js web framework.                                                |\n| express-rate-limit            | Rate limiting middleware for abuse protection.                        |\n| express-session               | Simple session middleware for Express.                                |\n| jquery                        | Front-end JS library to interact with HTML elements.                  |\n| keyv                          | key-value storage with support for multiple backends                  |\n| langchain                     | Framework for developing LLM applications                             |\n| lastfm                        | Last.fm API library.                                                  |\n| lusca                         | CSRF middleware.                                                      |\n| mailchecker                   | Verifies that an email address is valid and not a disposable address. |\n| mongodb                       | MongoDB driver                                                        |\n| mongoose                      | MongoDB ODM.                                                          |\n| morgan                        | HTTP request logger middleware for node.js.                           |\n| multer                        | Node.js middleware for handling `multipart/form-dat",
  "context": "README chunk 5"
}
