{
  "sha256": "1e01908f4a51c6fd2f1251be8f1acd5f8dee2a1f1fce86916fa2774b74a1f1c2",
  "source_url": "https://docs.langflow.org/components-overview",
  "fetched_at": "2026-05-02T00:00:00Z",
  "fetcher": "smadp-seed-author",
  "media_type": "text/html",
  "quote": "Langflow components include LLMs, agents, vector stores, and tools that can be combined visually to build agent flows.",
  "context": "Langflow docs \u2014 components overview.",
  "valid_at": "2026-05-02T00:00:00Z",
  "valid_status": "valid"
}
