{
  "sha256": "448e97e0389b25a2ec53e9b9a8560e9d703e4d911cd616c1c9d16335ae17cd4b",
  "source_url": "https://github.com/ChrisRoyse/Synapse/blob/HEAD/README.md",
  "fetched_at": "2026-07-17T03:03:25Z",
  "fetcher": "smadp.autopilot.profile_enrich.v1",
  "media_type": "text/markdown",
  "quote": "<p align=\"center\">\n  <img src=\"docs/assets/hero.png\" alt=\"Synapse \u2014 give your AI agent a real body on your Windows PC\" width=\"100%\">\n</p>\n\n<h1 align=\"center\">Synapse</h1>\n\n<p align=\"center\">\n  <strong>Turn opportunity into a numbers game.</strong><br>\n  Give any AI model a real body on your Windows PC \u2014 so it can find, chase, and win\n  opportunities around the clock while you keep your mouse.\n</p>\n\n<p align=\"center\">\n  <img src=\"https://img.shields.io/badge/status-live-22c55e?style=for-the-badge\" alt=\"Status: Live\">\n  <img src=\"https://img.shields.io/badge/platform-Windows%2010%20%2F%2011-0078D6?style=for-the-badge&logo=windows\" alt=\"Windows\">\n  <img src=\"https://img.shields.io/badge/built%20with-Rust-CE412B?style=for-the-badge&logo=rust\" alt=\"Rust\">\n  <img src=\"https://img.shields.io/badge/protocol-MCP-7C3AED?style=for-the-badge\" alt=\"MCP\">\n  <img src=\"https://img.shields.io/badge/MCP%20tools-40-0ea5e9?style=for-the-badge\" alt=\"40 MCP tools\">\n</p>\n\n<p align=\"center\">\n  <a href=\"https://www.youtube.com/@Leapableai\"><img src=\"https://img.shields.io/badge/YouTube-@Leapableai-FF0000?style=flat-square&logo=youtube&logoColor=white\" alt=\"YouTube\"></a>\n  <a href=\"https://x.com/ChrisRoyseAI1\"><img src=\"https://img.shields.io/badge/X-@ChrisRoyseAI1-000000?style=flat-square&logo=x&logoColor=white\" alt=\"X / Twitter\"></a>\n  <a href=\"https://www.linkedin.com/in/christopher-royse-b624b596/\"><img src=\"https://img.shields.io/badge/LinkedIn-Chris%20Royse-0A66C2?style=flat-square&logo=linkedin&logoColor=white\" alt=\"LinkedIn\"></a>\n</p>\n\n---\n\n## Why Synapse\n\n<p align=\"center\">\n  <img src=\"docs/assets/opportunity-engine.png\" alt=\"Synapse turns a flood of raw opportunities into a small set of wins\" width=\"100%\">\n</p>\n\n**Every business's growth is capped by one thing: the opportunities in front of it.**\nGrants. Clients. Contracts. Investors. Partnerships. Job leads. It doesn't matter\nwhat you do \u2014 if you want to grow, you need *more* and *better* opportunities. Everyone\nknows this. Almost nobody does the work, because the work is soul-crushing volume:\nhundreds of applications, thousands of outreach messages, endless forms.\n\nSynapse changes the math. It gives any AI model \u2014 Claude, Codex, whatever you run \u2014\na real body on your Windows PC: eyes to see the screen, hands to click and type, and\nthe stamina to run **24/7**. So instead of a person hand-picking the five opportunities\nthey have time for, an agent goes after *all* of them and brings back what actually\nqualified. **Opportunity stops being a qualitative bottleneck and becomes a quantitative\npipeline.**\n\n### Flip the script\n\n<img src=\"docs/assets/flip-the-script.png\" alt=\"Old way: hand-pick a few. Synapse way: pursue them all, then choose the winners.\" align=\"right\" width=\"42%\">\n\nThe old way: you have 1,000 possible opportunities, so you rank them, rationalize your\nway down to the \"best\" five, and let the other 995 die on the vine.\n\nThe Synapse way: you go after **all 1,000**. Then you sit back and choose from whatever\ncomes back \u2014 the meetings booked, the grants approved, the replies that landed. You were\nonly ever going to pursue the highest-payout few by hand. Now you can *also* pursue the\nthousand smaller ones you'd have skipped \u2014 and staff, sell, or ignore the wins on your\nown terms.\n\nIt's a complete inversion of how opportunity works: **apply to everything, then pick the\nwinners** \u2014 instead of picking first and applying to almost nothing.\n\n<br clear=\"all\">\n\n### What one always-on agent has actually done\n\nThese are **real overnight runs** on a single Synapse-connected agent \u2014 the kind of work\nno human would sit and do by hand, and no one would hire out:\n\n- \ud83c\udf31 **Found 270 startups** with over **$2M in seed funding** overnight \u2014 then went back\n  and **auto-filled applications** to pitch each one.\n- \ud83d\udcdd **Filed 40 grant applications** \u2014 the tedious, high-value paperwork that normally\n  never gets done.\n- \ud83d\udcec **Messaged 300+ VCs and angel investors** \u2014 turning into real replies, meetings,\n  and a live deal pipeline.\n\nNone of it required babysitting. You write one prompt; the agent works the list.\n\n### The economics\n\n<img src=\"docs/assets/always-on-agent.png\" alt=\"A 24/7 agent generating opportunities overnight while you sleep\" align=\"left\" width=\"42%\">\n\nFor roughly the cost of a **~$200/month** model subscription, you get an agent that runs\n**24 hours a day, 7 days a week**, doing nothing but generating opportunities. It never\ngets bored, never gets discouraged by rejection, and never skips the boring forms.\n\nThe most valuable thing here isn't removing work humans already do. It's unlocking\n**entirely new workflows** \u2014 the ones a human would *never* do manually (apply to a\nthousand grants, message every relevant investor, watch a channel around the clock) but\nthat you'd absolutely want done if something tireless could do them. Wake up to a full\ninbox of opportunities and decide which ones are worth your time.\n\n<br clear=\"all\">\n\n### It's the foot in the door\n\n<img src=\"docs/assets/foot-in-the-door.png\" alt=\"Synapse as the first high-value thing you deliver to a business\" align=\"right\" width=\"42%\">\n\nIf you sell services \u2014 agency, consulting, automation, AI \u2014 the hardest barrier is\n**trust**: trust in you, and trust in AI. The way past it is to hand someone *one thing*\nthat delivers obvious, immediate value. Once a business starts making money from that\nfirst thing, they trust you on everything else.\n\nSynapse is that first thing. Every business has the opportunity problem, and everyone\nrecognizes it the moment you name it. You don't even need to know their industry \u2014 walk\ninto an insurance office, a construction firm, a law practice, and the pitch is the same:\n*\"You have opportunities you're leaving on the table because chasing them isn't worth a\nperson's time. What if something chased all of them for you?\"* Install is light (a Rust\nruntime + Synapse, then you just prompt it), and you're in the door.\n\n> \ud83c\udf93 Want to learn how to pitch and deploy Synapse for real businesses? Follow along on\n> **[YouTube @Leapableai](https://www.youtube.com/@Leapableai)** and join the\n> **[Skool community](https://www.skool.com/calyx-5392)**.\n\n<br clear=\"all\">\n\n---\n\n## The idea in one line\n\n> **Your AI model is the brain. Synapse is the body.**\n\nLarge language models can reason brilliantly \u2014 but on their own they can't *see* your\nscreen, *move* your mouse, *press* a key, or *stay at it* for hours. Synapse is the\nmissing body: a fast, local **Rust** server that speaks the\n[Model Context Protocol](https://modelcontextprotocol.io) and plugs straight into\n**Claude Code, Codex, and the Claude Desktop app**, giving the connected model a real,\nlow-latency interface to your Windows machine. And not just *one* model \u2014 a whole\n**team of agents** can share the same PC through one Synapse daemon, each in its own\nisolated session, while you keep working.\n\n<p align=\"center\">\n  <img src=\"docs/assets/brain-body.png\" alt=\"The model is the brain; Synapse is the body that sees, acts, and reacts\" width=\"92%\">\n</p>\n\nEverything runs **on your machine**. No screen-scraping cloud service, no remote agent,\nno data leaving your PC. Synapse is Windows-native to the metal: Win32 `SendInput`, UI\nAutomation, Windows Graphics Capture / DXGI, optional debug-gated WASAPI audio capture,\nand local process control.\n\n---\n\n## What you can do with it\n\nSynapse exposes **40 focused MCP tools** \u2014 a small, clean facade surface where every tool\ntakes an explicit `operation`, and every mutating action names the source of truth it\nreads back from. (One tool, the raw browser debugger, is break-glass\u2013gated behind an\nexplicit profile switch.) Here's what those 40 tools unlock.\n\n### \ud83d\udc41\ufe0f It can see \u2014 structured perception\n\n<img src=\"docs/assets/perception.png\" alt=\"Synapse perceives the screen as structured data\" align=\"right\" width=\"42%\">\n\nSynapse hands the model the screen as **clean, low-token structured data**, not a giant\nscreenshot it has to squint at:\n\n- **`observe`** \u2014 the focused window,",
  "context": "README chunk 1"
}
