{
  "sha256": "deb3cf12c1e162c2a577b906fb9f36f3545b52ce783854fca3fd57eaa763794a",
  "source_url": "https://github.com/hsliuping/TradingAgents-CN/blob/HEAD/README.md",
  "fetched_at": "2026-06-12T03:44:44Z",
  "fetcher": "smadp.autopilot.profile_enrich.v1",
  "media_type": "text/markdown",
  "quote": "\u7ed9\u4e88\u5f00\u53d1\u8005\u6700\u5927\u7684\u81ea\u7531\n- **\ud83d\udcda \u77e5\u8bc6\u5206\u4eab**: \u611f\u8c22\u60a8\u4eec\u63d0\u4f9b\u7684\u8be6\u7ec6\u6587\u6863\u548c\u6700\u4f73\u5b9e\u8df5\u6307\u5bfc\n\n**\u7279\u522b\u611f\u8c22**\uff1a[TradingAgents](https://github.com/TauricResearch/TradingAgents) \u9879\u76ee\u4e3a\u6211\u4eec\u63d0\u4f9b\u4e86\u575a\u5b9e\u7684\u6280\u672f\u57fa\u7840\u3002\u867d\u7136Apache 2.0\u534f\u8bae\u8d4b\u4e88\u4e86\u6211\u4eec\u4f7f\u7528\u6e90\u7801\u7684\u6743\u5229\uff0c\u4f46\u6211\u4eec\u6df1\u77e5\u6bcf\u4e00\u884c\u4ee3\u7801\u7684\u73cd\u8d35\u4ef7\u503c\uff0c\u5c06\u6c38\u8fdc\u94ed\u8bb0\u5e76\u611f\u8c22\u60a8\u4eec\u7684\u65e0\u79c1\u8d21\u732e\u3002\n\n### \ud83c\udde8\ud83c\uddf3 \u63a8\u5e7f\u4f7f\u547d\u7684\u521d\u5fc3\n\n\u521b\u5efa\u8fd9\u4e2a\u4e2d\u6587\u589e\u5f3a\u7248\u672c\uff0c\u6211\u4eec\u6000\u7740\u4ee5\u4e0b\u521d\u5fc3\uff1a\n\n- **\ud83c\udf09 \u6280\u672f\u4f20\u64ad**: \u8ba9\u4f18\u79c0\u7684TradingAgents\u6280\u672f\u5728\u4e2d\u56fd\u5f97\u5230\u66f4\u5e7f\u6cdb\u7684\u5e94\u7528\n- **\ud83c\udf93 \u6559\u80b2\u666e\u53ca**: \u4e3a\u4e2d\u56fd\u7684AI\u91d1\u878d\u6559\u80b2\u63d0\u4f9b\u66f4\u597d\u7684\u5de5\u5177\u548c\u8d44\u6e90\n- **\ud83e\udd1d \u6587\u5316\u6865\u6881**: \u5728\u4e2d\u897f\u65b9\u6280\u672f\u793e\u533a\u4e4b\u95f4\u642d\u5efa\u4ea4\u6d41\u5408\u4f5c\u7684\u6865\u6881\n- **\ud83d\ude80 \u521b\u65b0\u63a8\u52a8**: \u63a8\u52a8\u4e2d\u56fd\u91d1\u878d\u79d1\u6280\u9886\u57df\u7684AI\u6280\u672f\u521b\u65b0\u548c\u5e94\u7528\n\n### \ud83c\udf0d \u5f00\u6e90\u793e\u533a\n\n\u611f\u8c22\u6240\u6709\u4e3a\u672c\u9879\u76ee\u8d21\u732e\u4ee3\u7801\u3001\u6587\u6863\u3001\u5efa\u8bae\u548c\u53cd\u9988\u7684\u5f00\u53d1\u8005\u548c\u7528\u6237\u3002\u6b63\u662f\u56e0\u4e3a\u6709\u4e86\u5927\u5bb6\u7684\u652f\u6301\uff0c\u6211\u4eec\u624d\u80fd\u66f4\u597d\u5730\u670d\u52a1\u4e2d\u6587\u7528\u6237\u793e\u533a\u3002\n\n### \ud83e\udd1d \u5408\u4f5c\u5171\u8d62\n\n\u6211\u4eec\u627f\u8bfa\uff1a\n\n- **\u5c0a\u91cd\u539f\u521b**: \u59cb\u7ec8\u5c0a\u91cd\u6e90\u9879\u76ee\u7684\u77e5\u8bc6\u4ea7\u6743\u548c\u5f00\u6e90\u534f\u8bae\n- **\u53cd\u9988\u8d21\u732e**: \u5c06\u6709\u4ef7\u503c\u7684\u6539\u8fdb\u548c\u521b\u65b0\u53cd\u9988\u7ed9\u6e90\u9879\u76ee\u548c\u5f00\u6e90\u793e\u533a\n- **\u6301\u7eed\u6539\u8fdb**: \u4e0d\u65ad\u5b8c\u5584\u4e2d\u6587\u589e\u5f3a\u7248\u672c\uff0c\u63d0\u4f9b\u66f4\u597d\u7684\u7528\u6237\u4f53\u9a8c\n- **\u5f00\u653e\u5408\u4f5c**: \u6b22\u8fce\u4e0e\u6e90\u9879\u76ee\u56e2\u961f\u548c\u5168\u7403\u5f00\u53d1\u8005\u8fdb\u884c\u6280\u672f\u4ea4\u6d41\u4e0e\u5408\u4f5c\n\n## [\u611f\u8c22AIHubmix\u8d5e\u52a9\uff0c\u63a8\u8350llm\u6a21\u578b\u4f7f\u7528AIHubmix](https://aihubmix.com/?aff=2rIi)\n\n<a href=\"https://aihubmix.com/?aff=2rIi\" target=\"_blank\" rel=\"noopener noreferrer\">\n  <img src=\"assets/AIHubmixlogo.png\" alt=\"AIHubMix\" width=\"220\"/>\n</a>\n\n## \ud83d\udcc8 \u7248\u672c\u5386\u53f2\n\n- **v1.0.1** (2026-04-14): \ud83d\udd27 \u914d\u7f6e\u7ba1\u7406\u4f18\u5316\u3001AiHubMix \u805a\u5408\u5382\u5bb6\u3001\u5355\u80a1\u540c\u6b65\u589e\u5f3a\u4e0e\u4e0a\u6e38\u80fd\u529b\u5438\u6536 \u2728 **\u5f53\u524d\u7248\u672c**\n- **v1.0.0-preview** (2025-10-10): \ud83c\udfd7\ufe0f FastAPI + Vue 3 \u65b0\u67b6\u6784\u9884\u89c8\u7248\n- **v0.1.13** (2025-08-02): \ud83e\udd16 \u539f\u751fOpenAI\u652f\u6301\u4e0eGoogle AI\u751f\u6001\u7cfb\u7edf\u5168\u9762\u96c6\u6210\n- **v0.1.12** (2025-07-29): \ud83e\udde0 \u667a\u80fd\u65b0\u95fb\u5206\u6790\u6a21\u5757\u4e0e\u9879\u76ee\u7ed3\u6784\u4f18\u5316\n- **v0.1.11** (2025-07-27): \ud83e\udd16 \u591aLLM\u63d0\u4f9b\u5546\u96c6\u6210\u4e0e\u6a21\u578b\u9009\u62e9\u6301\u4e45\u5316\n- **v0.1.10** (2025-07-18): \ud83d\ude80 Web\u754c\u9762\u5b9e\u65f6\u8fdb\u5ea6\u663e\u793a\u4e0e\u667a\u80fd\u4f1a\u8bdd\u7ba1\u7406\n- **v0.1.9** (2025-07-16): \ud83c\udfaf CLI\u7528\u6237\u4f53\u9a8c\u91cd\u5927\u4f18\u5316\u4e0e\u7edf\u4e00\u65e5\u5fd7\u7ba1\u7406\n- **v0.1.8** (2025-07-15): \ud83c\udfa8 Web\u754c\u9762\u5168\u9762\u4f18\u5316\u4e0e\u7528\u6237\u4f53\u9a8c\u63d0\u5347\n- **v0.1.7** (2025-07-13): \ud83d\udc33 \u5bb9\u5668\u5316\u90e8\u7f72\u4e0e\u4e13\u4e1a\u62a5\u544a\u5bfc\u51fa\n- **v0.1.6** (2025-07-11): \ud83d\udd27 \u963f\u91cc\u767e\u70bc\u4fee\u590d\u4e0e\u6570\u636e\u6e90\u5347\u7ea7\n- **v0.1.5** (2025-07-08): \ud83d\udcca \u6dfb\u52a0Deepseek\u6a21\u578b\u652f\u6301\n- **v0.1.4** (2025-07-05): \ud83c\udfd7\ufe0f \u67b6\u6784\u4f18\u5316\u4e0e\u914d\u7f6e\u7ba1\u7406\u91cd\u6784\n- **v0.1.3** (2025-06-28): \ud83c\udde8\ud83c\uddf3 A\u80a1\u5e02\u573a\u5b8c\u6574\u652f\u6301\n- **v0.1.2** (2025-06-15): \ud83c\udf10 Web\u754c\u9762\u548c\u914d\u7f6e\u7ba1\u7406\n- **v0.1.1** (2025-06-01): \ud83e\udde0 \u56fd\u4ea7LLM\u96c6\u6210\n\n\ud83d\udccb **\u8be6\u7ec6\u66f4\u65b0\u65e5\u5fd7**: [CHANGELOG.md](./docs/releases/CHANGELOG.md)\n\n## \ud83d\udcde \u8054\u7cfb\u65b9\u5f0f\n\n- **GitHub Issues**: [\u63d0\u4ea4\u95ee\u9898\u548c\u5efa\u8bae](https://github.com/hsliuping/TradingAgents-CN/issues)\n- **\u90ae\u7bb1**: hsliup@163.com\n- \u9879\u76ee\uff31\uff31\u7fa4\uff1a1091917201\n- \u9879\u76ee\u5fae\u4fe1\u516c\u4f17\u53f7\uff1aTradingAgents-CN\n\n  <img src=\"assets/wexin.png\" alt=\"\u5fae\u4fe1\u516c\u4f17\u53f7\" width=\"200\"/>\n\n- **\u539f\u9879\u76ee**: [TauricResearch/TradingAgents](https://github.com/TauricResearch/TradingAgents)\n- **\u6587\u6863**: [\u5b8c\u6574\u6587\u6863\u76ee\u5f55](docs/)\n\n## \u26a0\ufe0f \u98ce\u9669\u63d0\u793a\n\n**\u91cd\u8981\u58f0\u660e**: \u672c\u6846\u67b6\u4ec5\u7528\u4e8e\u7814\u7a76\u548c\u6559\u80b2\u76ee\u7684\uff0c\u4e0d\u6784\u6210\u6295\u8d44\u5efa\u8bae\u3002\n\n- \ud83d\udcca \u4ea4\u6613\u8868\u73b0\u53ef\u80fd\u56e0\u591a\u79cd\u56e0\u7d20\u800c\u5f02\n- \ud83e\udd16 AI\u6a21\u578b\u7684\u9884\u6d4b\u5b58\u5728\u4e0d\u786e\u5b9a\u6027\n- \ud83d\udcb0 \u6295\u8d44\u6709\u98ce\u9669\uff0c\u51b3\u7b56\u9700\u8c28\u614e\n- \ud83d\udc68\u200d\ud83d\udcbc \u5efa\u8bae\u54a8\u8be2\u4e13\u4e1a\u8d22\u52a1\u987e\u95ee\n\n---\n\n<div align=\"center\">\n\n**\ud83c\udf1f \u5982\u679c\u8fd9\u4e2a\u9879\u76ee\u5bf9\u60a8\u6709\u5e2e\u52a9\uff0c\u8bf7\u7ed9\u6211\u4eec\u4e00\u4e2a Star\uff01**\n\n[\u2b50 Star this repo](https://github.com/hsliuping/TradingAgents-CN) | [\ud83c\udf74 Fork this repo](https://github.com/hsliuping/TradingAgents-CN/fork) | [\ud83d\udcd6 Read the docs](./docs/)\n\n</div>\n",
  "context": "README chunk 2"
}
