{
  "sha256": "3ee140a764453356c4888360048640c57460af4a5dd6866ae9375f2cdbf4dc82",
  "source_url": "https://github.com/tylerjrbuell/reactive-agents-ts/blob/HEAD/README.md",
  "fetched_at": "2026-06-12T15:06:59Z",
  "fetcher": "smadp.autopilot.profile_enrich.v1",
  "media_type": "text/markdown",
  "quote": " 'query',\n                            type: 'string',\n                            description: 'Search query',\n                            required: true,\n                        },\n                    ],\n                    riskLevel: 'low',\n                    timeoutMs: 10_000,\n                    requiresApproval: false,\n                    source: 'function',\n                },\n                handler: (args) => Effect.succeed(`Results for: ${args.query}`),\n            },\n        ],\n    })\n    .build()\n```\n\n### Dynamic Tool Registration\n\nAdd or remove tools from a running agent at runtime:\n\n```typescript\nimport { Effect } from 'effect'\n\nconst agent = await ReactiveAgents.create()\n    .withName('adaptive-agent')\n    .withProvider('anthropic')\n    .withReasoning()\n    .withTools()\n    .build()\n\n// Register a new tool at runtime\nawait agent.registerTool(\n    {\n        name: 'custom_api',\n        description: 'Call the custom API',\n        parameters: [\n            {\n                name: 'endpoint',\n                type: 'string',\n                description: 'API endpoint',\n                required: true,\n            },\n        ],\n        riskLevel: 'low',\n        source: 'function',\n    },\n    (args) => Effect.succeed(`Response from ${args.endpoint}`)\n)\n\n// Later, remove it when no longer needed\nawait agent.unregisterTool('custom_api')\n```\n\n### Dynamic Sub-Agent Spawning\n\nUse `.withDynamicSubAgents()` to let the model spawn ad-hoc sub-agents at runtime without pre-configuring named agent tools. This registers the built-in `spawn-agent` tool, which the model can invoke freely:\n\n```typescript\nconst agent = await ReactiveAgents.create()\n    .withProvider('anthropic')\n    .withModel('claude-sonnet-4-6')\n    .withTools()\n    .withDynamicSubAgents({ maxIterations: 5 })\n    .build()\n```\n\nSub-agents receive a clean context window, inherit the parent's provider and model by default, and are depth-limited to `MAX_RECURSION_DEPTH = 3`.\n\n| Approach                         | When to use                                            |\n| -------------------------------- | ------------------------------------------------------ |\n| `.withAgentTool(\"name\", config)` | Named, purpose-built sub-agent with a specific role    |\n| `.withDynamicSubAgents()`        | Ad-hoc delegation at model's discretion, unknown tasks |\n\n## MCP (Model Context Protocol)\n\nConnect any MCP-compatible server \u2014 9,400+ public servers covering filesystem, GitHub, Slack, browsers, databases, and more. Use `.withMCP()` for each server you need:\n\n```typescript\nimport { ReactiveAgents } from 'reactive-agents'\n\n// stdio transport \u2014 subprocess communicates via JSON-RPC over stdin/stdout\nconst agent = await ReactiveAgents.create()\n    .withProvider('anthropic')\n    .withReasoning()\n    .withMCP({\n        name: 'filesystem',\n        transport: 'stdio',\n        command: 'bunx',\n        args: ['-y', '@modelcontextprotocol/server-filesystem', '.'],\n    })\n    .withMCP({\n        name: 'github',\n        transport: 'stdio',\n        command: 'bunx',\n        args: ['-y', '@modelcontextprotocol/server-github'],\n        env: { GITHUB_PERSONAL_ACCESS_TOKEN: process.env.GH_TOKEN ?? '' },\n    })\n    .build()\n\n// Streamable HTTP transport \u2014 modern cloud-hosted MCP servers\nconst agent2 = await ReactiveAgents.create()\n    .withProvider('anthropic')\n    .withMCP({\n        name: 'stripe',\n        transport: 'streamable-http',\n        endpoint: 'https://mcp.stripe.com',\n        headers: { Authorization: `Bearer ${process.env.STRIPE_SECRET_KEY}` },\n    })\n    .build()\n```\n\nMCP tools appear in the tool registry alongside custom tools \u2014 the LLM sees them all uniformly. Mix MCP servers with `ToolBuilder` custom tools in the same agent. See [full MCP docs](https://docs.reactiveagents.dev/guides/tools/).\n\n## Testing\n\nBuilt-in test scenario support for deterministic, offline tests:\n\n```typescript\nconst agent = await ReactiveAgents.create()\n    .withTestScenario([\n        { match: 'capital of France', text: 'Paris is the capital of France.' },\n    ])\n    .build()\n\nconst result = await agent.run('What is the capital of France?')\n// result.output -> \"Paris is the capital of France.\"\n```\n\nThe `@reactive-agents/testing` package includes streaming assertions and pre-built scenario fixtures:\n\n```typescript\nimport {\n    expectStream,\n    createGuardrailBlockScenario,\n    createBudgetExhaustedScenario,\n} from '@reactive-agents/testing'\n\n// Stream assertions\nconst stream = agent.runStream('Write a haiku')\nawait expectStream(stream)\n    .toEmitTextDeltas()\n    .toComplete()\n    .toEmitEvents(['TextDelta', 'StreamCompleted'])\n\n// Pre-built scenario fixtures\nconst scenario = createGuardrailBlockScenario() // agent + prompt that triggers guardrail\nconst budget = createBudgetExhaustedScenario() // agent + prompt that exhausts budget\nconst maxIter = createMaxIterationsScenario() // agent + prompt that hits max iterations\n```\n\n## Development\n\n```bash\nbun install              # Install dependencies\nbun test                 # Run full test suite (5,320 tests / 603 files, ~65s)\nbun run build            # Build all packages (ESM + DTS via tsup)\n```\n\n## Environment Variables\n\n```bash\nANTHROPIC_API_KEY=sk-ant-...          # Anthropic Claude\nOPENAI_API_KEY=sk-...                 # OpenAI GPT-4o\nGOOGLE_API_KEY=...                    # Google Gemini\nEMBEDDING_PROVIDER=openai             # For vector memory\nEMBEDDING_MODEL=text-embedding-3-small\nLLM_DEFAULT_MODEL=claude-sonnet-4-6\n```\n\n## Documentation\n\nFull documentation at **[docs.reactiveagents.dev](https://docs.reactiveagents.dev/)**\n\n-   [Getting Started](https://docs.reactiveagents.dev/guides/quickstart/) -- Build an agent in 5 minutes\n-   [Reasoning Strategies](https://docs.reactiveagents.dev/guides/choosing-strategies/) -- All 6 strategies explained\n-   [Architecture](https://docs.reactiveagents.dev/concepts/architecture/) -- Layer system deep dive\n-   [Cookbook](https://docs.reactiveagents.dev/cookbook/testing-agents/) -- Testing, multi-agent patterns, production deployment\n\n## Used By\n\nReactive Agents is in early access. If you're using it in production or a research project, [open a PR](https://github.com/tylerjrbuell/reactive-agents-ts/edit/main/README.md) adding your name here, or drop a note in [Discussions](https://github.com/tylerjrbuell/reactive-agents-ts/discussions).\n\n<!-- BEGIN-USED-BY -->\n*Your team here.*\n<!-- END-USED-BY -->\n\n## Roadmap\n\nPublic milestone tracker: [`ROADMAP.md`](./ROADMAP.md) \u2014 synced with internal North Star v5.0.\nLive board: [GitHub Projects \u2014 Reactive Agents Roadmap](https://github.com/users/tylerjrbuell/projects/1).\n\n## Getting Help\n\n-   **Discord** -- [Join the community](https://discord.gg/Mp99vQam3Q) for questions, discussions, and support\n-   **GitHub Issues** -- [Report bugs or request features](https://github.com/tylerjrbuell/reactive-agents-ts/issues)\n-   **GitHub Discussions** -- [Ask questions and share ideas](https://github.com/tylerjrbuell/reactive-agents-ts/discussions)\n-   **Security** -- File privately via [GitHub Security Advisory](https://github.com/tylerjrbuell/reactive-agents-ts/security/advisories/new)\n\n## Contributors\n\n<a href=\"https://github.com/tylerjrbuell/reactive-agents-ts/graphs/contributors\">\n  <img src=\"https://contrib.rocks/image?repo=tylerjrbuell/reactive-agents-ts\" alt=\"Contributors\" />\n</a>\n\n## License\n\nMIT\n",
  "context": "README chunk 6"
}
