{
  "sha256": "2809b2b988dd3e543c395afb2a90ed5703159b0e6196217d35c9044dea0d3ac5",
  "source_url": "https://github.com/arnaldo-delisio/claude-code-studio/blob/HEAD/README.md",
  "fetched_at": "2026-07-25T18:00:16Z",
  "fetcher": "smadp.autopilot.profile_enrich.v1",
  "media_type": "text/markdown",
  "quote": "tc.\n- Projects: Your project locations\n- Preferences: Coding style, frameworks\n```\n\n### 2. Agent Customization\n\n**Add Custom Agents** to AGENTS.md:\n```markdown\n#### your-custom-agent\n- **Specialization**: Your specific domain expertise\n- **Best for**: Specific use cases\n- **Auto-activates**: Trigger conditions\n- **Context overhead**: ~13k tokens (same as all studio agents)\n```\n\n### 3. MCP Server Configuration\n\n**Update MCP.md** with your servers:\n```yaml\nyour_custom_server:\n  description: \"Your server description\"\n  capabilities: [\"capability1\", \"capability2\"]\n  usage_patterns: [\"when to use\", \"best practices\"]\n```\n\n### 4. Principle Alignment\n\n**Modify PRINCIPLES.md** to match your development philosophy:\n- Code quality standards\n- Testing approaches  \n- Documentation requirements\n- Team collaboration rules\n\n## \ud83d\udca1 Usage Examples: Context-Efficient Development\n\n### Creating a New Feature (0 Context Used)\n```\nI need to build a user authentication system with React frontend and Node.js backend\n```\n\n**Studio Response - All with Fresh Context:**\n1. `backend-architect` spawns \u2192 designs the API structure \u2192 exits\n2. `frontend-developer` spawns \u2192 creates React components \u2192 exits  \n3. `file-creator` spawns \u2192 sets up the directory structure \u2192 exits\n4. `test-writer-fixer` spawns \u2192 generates comprehensive tests \u2192 exits\n5. `git-workflow` spawns \u2192 manages commits and branches \u2192 exits\n\n**Context Impact**: Your main conversation used **0 messages** for this complex feature. All 297+ messages still available.\n\n### Debugging Production Issues (0 Context Used)\n```\nOur app is experiencing high error rates in production\n```\n\n**Studio Response - Parallel Investigation:**\n1. `analytics-reporter` spawns \u2192 analyzes error metrics \u2192 exits\n2. `sentry` MCP \u2192 retrieves detailed error traces \u2192 exits\n3. `sequential-thinking` spawns \u2192 performs root cause analysis \u2192 exits\n4. `devops-automator` spawns \u2192 suggests deployment fixes \u2192 exits\n5. `support-responder` spawns \u2192 drafts user communications \u2192 exits\n\n**Context Impact**: Complex production debugging completed without consuming any conversation context.\n\n### All-Day Development Session Example\n```\nMorning: \"Build user auth system\"     \u2192 Agents handle, 0 context used\nMidday: \"Add payment integration\"     \u2192 Agents handle, 0 context used  \nAfternoon: \"Debug performance issue\" \u2192 Agents handle, 0 context used\nEvening: \"Deploy to production\"      \u2192 Agents handle, 0 context used\n```\n\n**Traditional Approach**: 4 separate conversations, constant re-explaining context\n**Studio Approach**: 1 continuous conversation, 300+ messages, full project memory\n\n## \ud83e\udd1d Contributing\n\nWe welcome contributions! Here's how to get involved:\n\n### 1. Agent Development\n- Create specialized agents for new domains\n- Enhance existing agent capabilities\n- Improve agent coordination workflows\n\n### 2. MCP Integration\n- Add support for new MCP servers\n- Optimize existing server configurations\n- Create intelligent decision trees\n\n### 3. Documentation\n- Improve setup guides and tutorials\n- Add usage examples and best practices\n- Translate documentation\n\n### 4. Templates\n- Create templates for new frameworks\n- Enhance existing component templates\n- Add industry-specific templates\n\n### Contribution Process\n1. Fork the repository\n2. Create a feature branch: `git checkout -b feature/amazing-agent`\n3. Make your changes and test thoroughly\n4. Submit a pull request with detailed description\n\n### Code Style\n- Follow existing patterns and conventions\n- Include comprehensive documentation\n- Add usage examples for new features\n- Test all configurations before submitting\n\n## \ud83d\udcc4 License\n\nThis project is licensed under the MIT License - see the [LICENSE](LICENSE) file for details.\n\n### What This Means\n- \u2705 **Use freely** in personal and commercial projects\n- \u2705 **Modify** and adapt to your needs\n- \u2705 **Distribute** and share with others\n- \u2705 **Include** in proprietary software\n- \u2139\ufe0f **Attribution** appreciated but not required\n\n## \ud83d\ude4f Acknowledgments\n\n### Core Contributors\n\n**[Contains Studio](https://github.com/contains-studio/agents)** \ud83c\udfaf  \nProvided the complete 40+ agent system that forms the heart of this studio. Their revolutionary vision of department-organized, specialized AI agents with 6-day sprint methodology enables the rapid development capabilities this project provides. The entire agent ecosystem - from engineering to marketing to testing - originates from their innovative work.\n\n**[Agent OS by Builder Methods](https://github.com/buildermethods/agent-os)** \ud83d\udd27  \nContributed foundational concepts for utility agent patterns and systematic AI development workflows. Their approach to structured, spec-driven agentic development influenced the utility agent implementation and workflow optimization principles.\n\n### Special Thanks\n- **Anthropic** for creating the AI platform that enables this ecosystem\n- **Development Community** for inspiration and collaborative feedback\n- **MCP Server Developers** for building the tools that power the integrations\n- **Open Source Contributors** who make projects like this possible\n\n### Philosophy Credits\n- **6-Day Sprint Methodology**: Contains Studio's rapid development framework\n- **Agent-First Development**: Core principle from Contains Studio\n- **Structured AI Workflows**: Concepts from Agent OS systematic approach\n- **Domain Specialization**: Department-based organization by Contains Studio\n\n### Built With\n- AI-powered development environment with MCP integration\n- [Model Context Protocol](https://modelcontextprotocol.io/) - Standardized AI-tool integration\n- [Various MCP Servers](https://github.com/modelcontextprotocol/servers) - Specialized tool integrations\n\n### Inspiration\nThis project was inspired by the frustrating reality of hitting context limits every 50-100 messages, and the vision of AI-augmented development where:\n- **Conversations never die from context limits**\n- **Humans focus on creativity and strategy**\n- **AI handles repetitive tasks with fresh, focused context**  \n- **Development sessions last all day, not all morning**\n\n---\n\n<div align=\"center\">\n  \n**\ud83d\ude80 End Context Limit Frustration Forever! \ud83d\ude80**\n\n**Finally develop features without watching your message count.**\n\n[Get Unlimited Conversations](#quick-start) \u2022 [See Agent System](#agent-system) \u2022 [Context Benefits](#-conversation-longevity-benefits)\n\n*Transform your 50-message conversations into 300+ message development marathons*\n\n</div>",
  "context": "README chunk 3"
}
