{
  "sha256": "e810a0551f0ae7e341d0b43fdfa1fe0a4208b2d6ead6aa4f6998350180f11c64",
  "source_url": "https://github.com/aristoapp/awesome-second-brain/blob/HEAD/README.md",
  "fetched_at": "2026-06-12T00:58:43Z",
  "fetcher": "smadp.autopilot.profile_enrich.v1",
  "media_type": "text/markdown",
  "quote": "flows or products. | App owners still need to verify how retrieved context is used. |\n| [Hyperspell](solutions/hyperspell.md) | Collect, Organize, Evolve, Use | You need workspace context, metadata, live search, procedural memory, and agent-facing APIs. | Private beta and product availability may affect adoption. |\n| [Honcho](solutions/honcho.md) | Organize, Evolve, Use | You need peer representations, conclusions, session context, and user or agent modeling over time. | Developer integration and hosting choices matter. |\n| [Hindsight](solutions/hindsight.md) | Organize, Evolve, Use | You need memory banks, observations, consolidation, and multi-mode recall for agents. | Retrieval-to-action evidence depends on the surrounding workflow. |\n| [Mnemosyne](solutions/mnemosyne.md) | Organize, Evolve, Use | You need local SQLite memory with MCP, SDK, CLI, Hermes integration, tiers, and consolidation. | Local operation and agent logging still need owner attention. |\n| [taOSmd](solutions/taosmd.md) | Organize, Evolve, Use, Govern | You want an offline, local-first agent memory layer on modest or single-board hardware, with a zero-loss verbatim archive and MCP, HTTP, API, and CLI access. | You run a local LLM and embedding model yourself, and there is no PyPI package or hosted option yet. |\n| [Mem0/OpenMemory](solutions/mem0-openmemory.md) | Evolve, Use | You need user/run-scoped memory for apps with hosted or self-hosted paths. | More of an app memory primitive than a complete second-brain workflow. |\n\n### Memory Substrates\n\n| Solution | Strongest lifecycle coverage | Best when | Main tradeoff |\n|---|---|---|---|\n| [Zep/Graphiti](solutions/zep-graphiti.md) | Organize, Evolve, Use | You need temporal graph memory and Graph RAG under an application. | Not a complete user-facing second brain by itself. |\n| [Cognee](solutions/cognee.md) | Organize, Evolve, Use | You need graph-oriented memory infrastructure with SDK, MCP, API, plugins, or cloud paths. | Requires application or workflow integration above it. |\n\n### Platform Baselines\n\n| Solution | Strongest lifecycle coverage | Best when | Main tradeoff |\n|---|---|---|---|\n| [ChatGPT Memory](solutions/chatgpt-memory.md) | Collect, Evolve, Use | You already live in ChatGPT and want platform-local personalization. | Platform-controlled visibility, retrieval, and export. |\n| [Claude Projects/Claude Code](solutions/claude-projects-code.md) | Collect, Organize, Use | Your work lives inside Claude Projects, Claude Code, or Claude connectors. | Context is scoped to Claude workflows and plan/workspace controls. |\n| [NotebookLM](solutions/notebooklm.md) | Collect, Organize, Use | You need grounded work over a bounded source set. | Not designed as a cross-tool evolving second brain. |\n\n## Deep Dives\n\n| Page | Use it for |\n|---|---|\n| [Chooser](comparisons/chooser.md) | Pick a starting solution by lifecycle gap and tradeoff. |\n| [Solution Layers](comparisons/solution-layers.md) | Understand the app, workspace, API layer, substrate, or platform shape after choosing a lifecycle gap. |\n| [Capability Matrix](comparisons/capability-matrix.md) | Compare lifecycle support, governance, operating burden, activation surfaces, and setup time. |\n| [Capability Definitions](capabilities/README.md) | Understand the evaluation dimensions behind the matrix. |\n| [Activation Evidence](capabilities/activation-evidence.md) | Evaluate whether retrieved memory was loaded, cited, refused, written back, or actually used. |\n| [Setup Burden](comparisons/setup-burden.md) | See what you actually have to operate. |\n| [Agent Activation](comparisons/agent-access.md) | Compare MCP, API, SDK, CLI, and plugin access as second-brain activation channels. |\n| [Local vs Cloud](comparisons/local-vs-cloud.md) | Decide where memory should live. |\n| [Personal vs Team](comparisons/personal-vs-team.md) | Compare solo, project, team, and organization fit. |\n| [Setup Guides](setup-guides/README.md) | Add hands-on setup notes only after verification. |\n| [Examples](examples/README.md) | Describe concrete second-brain workflows and scenarios. |\n| [Watchlist](watchlist.md) | Track promising systems that are not yet fully evaluated. |\n\n## Sources\n\nCore claims should be backed by official documentation, official repositories, or local hands-on reports. This repo should point to official setup docs instead of duplicating step-by-step installation instructions.\n\n## How To Contribute\n\n1. Pick the smallest contribution type that fits your evidence: core solution, capability/comparison update, setup guide, example, or watchlist entry.\n2. Use [templates/system-profile.md](templates/system-profile.md) or [templates/capability-page.md](templates/capability-page.md).\n3. Use primary sources or mark unverified fields as `Unknown`.\n4. For core solution profiles, link the solution from the relevant chooser, comparison, and capability pages so readers can evaluate it through the main decision paths.\n5. Open a PR with sources, verification notes, and any known limitations.\n\nSee [CONTRIBUTING.md](CONTRIBUTING.md) for the contribution guidelines.\n\n## Star History\n\n<a href=\"https://www.star-history.com/?repos=aristoapp%2Fawesome-second-brain&type=date&legend=top-left\">\n <picture>\n   <source media=\"(prefers-color-scheme: dark)\" srcset=\"https://api.star-history.com/chart?repos=aristoapp/awesome-second-brain&type=date&theme=dark&legend=top-left\" />\n   <source media=\"(prefers-color-scheme: light)\" srcset=\"https://api.star-history.com/chart?repos=aristoapp/awesome-second-brain&type=date&legend=top-left\" />\n   <img alt=\"Star History Chart\" src=\"https://api.star-history.com/chart?repos=aristoapp/awesome-second-brain&type=date&legend=top-left\" />\n </picture>\n</a>\n",
  "context": "README chunk 2"
}
