{
  "sha256": "bb6c4a66361243a0fcb6cbe0ef6a83feb3fc9dfde692234fcbe98286c5ad12e0",
  "source_url": "https://github.com/ai-boost/awesome-a2a/blob/HEAD/README.md",
  "fetched_at": "2026-06-12T00:12:58Z",
  "fetcher": "smadp.autopilot.profile_enrich.v1",
  "media_type": "text/markdown",
  "quote": "ion, and case transformation support. Published on RubyGems.\n    *   \ud83c\udf1f [llm.rb](https://github.com/llmrb/llm.rb) by [@llmrb](https://github.com/llmrb) [![Stars](https://img.shields.io/github/stars/llmrb/llm.rb?style=social)](https://github.com/llmrb/llm.rb) - Ruby's most capable AI runtime with A2A support via `LLM::A2A`, letting agents consume remote A2A agent skills as local tools over REST/JSON-RPC. Licensed under 0BSD.\n*   **C++**\n    *   \ud83c\udf1f [agent-protocol](https://github.com/openJiuwen-ai/agent-protocol) by [@openJiuwen-ai](https://github.com/openJiuwen-ai) [![Stars](https://img.shields.io/github/stars/openJiuwen-ai/agent-protocol?style=social)](https://github.com/openJiuwen-ai/agent-protocol) - C++ SDK for the Agent2Agent (A2A) Protocol (and MCP), providing implementations of agent communication protocols for C++ environments.\n    *   \ud83c\udf1f [a2a-cpp](https://github.com/MisterVVP/a2a-cpp) by [@MisterVVP](https://github.com/MisterVVP) [![Stars](https://img.shields.io/github/stars/MisterVVP/a2a-cpp?style=social)](https://github.com/MisterVVP/a2a-cpp) - C++20 SDK for the Agent2Agent (A2A) Protocol with client/server APIs, discovery, REST/JSON-RPC/gRPC transports, streaming, authentication hooks, and CMake/vcpkg/Conan build integration.\n*   **Common Lisp**\n    *   \ud83c\udf1f [mcp-lisp](https://github.com/jsulmont/mcp-lisp) by [@jsulmont](https://github.com/jsulmont) [![Stars](https://img.shields.io/github/stars/jsulmont/mcp-lisp?style=social)](https://github.com/jsulmont/mcp-lisp) - Common Lisp SDK for MCP and A2A protocols with server, client, agent, and behavioral spec engine. Implements partial A2A v1.0 support (agent card discovery, messaging, skills, and task lifecycle). Features 438 unit tests, REPL agent with multi-provider LLM support, and agent swarm capabilities. Dual-licensed under MIT OR Apache-2.0.\n*   **C#/.NET**\n    *   \ud83c\udf1f [a2a-dotnet](https://github.com/a2aproject/a2a-dotnet) by [@a2aproject](https://github.com/a2aproject) [![Stars](https://img.shields.io/github/stars/a2aproject/a2a-dotnet?style=social)](https://github.com/a2aproject/a2a-dotnet) - **Official** C#/.NET SDK for the A2A Protocol.\n    *   \ud83c\udf1f [a2adotnet](https://github.com/azixaka/a2adotnet) by [@azixaka](https://github.com/azixaka) [![Stars](https://img.shields.io/github/stars/azixaka/a2adotnet?style=social)](https://github.com/azixaka/a2adotnet) - A C#/.NET implementation of the A2A protocol.\n    *   \ud83c\udf1f [a2a-net](https://github.com/neuroglia-io/a2a-net) by [@neuroglia-io](https://github.com/neuroglia-io) [![Stars](https://img.shields.io/github/stars/neuroglia-io/a2a-net?style=social)](https://github.com/neuroglia-io/a2a-net) - .NET implementation of the Agent2Agent (A2A) protocol to enable secure, interoperable communication between autonomous agents across frameworks and vendors.\n*   **JavaScript/TypeScript**\n    *   \ud83c\udf1f [a2a-js](https://github.com/a2aproject/a2a-js) by [@a2aproject](https://github.com/a2aproject) [![Stars](https://img.shields.io/github/stars/a2aproject/a2a-js?style=social)](https://github.com/a2aproject/a2a-js) - **Official** JavaScript SDK for the Agent2Agent (A2A) Protocol.\n    *   \ud83c\udf1f [a2a-ai-provider](https://github.com/DracoBlue/a2a-ai-provider) by [@DracoBlue](https://github.com/DracoBlue) [![Stars](https://img.shields.io/github/stars/DracoBlue/a2a-ai-provider?style=social)](https://github.com/DracoBlue/a2a-ai-provider) - Community A2A provider for the Vercel AI SDK, enabling drop-in interoperability with A2A agents via `generateText` and `streamText`.\n    *   \ud83c\udf1f [nestjs-a2a](https://github.com/thestupd/nestjs-a2a) by [@thestupd](https://github.com/thestupd) [![Stars](https://img.shields.io/github/stars/thestupd/nestjs-a2a?style=social)](https://github.com/thestupd/nestjs-a2a) - A module for integrating the A2A protocol into NestJS applications.\n    *   \ud83c\udf1f [Artinet SDK](https://github.com/the-artinet-project/artinet-sdk) by [@the-artinet-project](https://github.com/the-artinet-project) [![Stars](https://img.shields.io/github/stars/the-artinet-project/artinet-sdk?style=social)](https://github.com/the-artinet-project/artinet-sdk) - TypeScript (Node.js) A2A compliant server/client simplifying interoperable AI agent creation, focusing on DX and production-readiness.\n    *   \ud83c\udf1f [a2a-mesh](https://github.com/oaslananka/a2a-mesh) by [@oaslananka](https://github.com/oaslananka) [![Stars](https://img.shields.io/github/stars/oaslananka/a2a-mesh?style=social)](https://github.com/oaslananka/a2a-mesh) - Production-ready TypeScript runtime for Google's A2A Protocol with multi-framework adapters, registry control plane, JWT/API-key auth, OpenTelemetry observability, CLI scaffolding, and testing toolkit. Published on npm.\n    *   \ud83c\udf1f [a2a-reference-ts](https://github.com/reaatech/a2a-reference-ts) by [@reaatech](https://github.com/reaatech) [![Stars](https://img.shields.io/github/stars/reaatech/a2a-reference-ts?style=social)](https://github.com/reaatech/a2a-reference-ts) - Production-ready TypeScript reference implementation of Google's A2A protocol with server framework (Express/Hono adapters), client SDK, bidirectional A2A \u2194 MCP bridge, canonical Zod schemas, pluggable auth (OAuth2/JWT/API key), Redis/Postgres persistence, SSE streaming, and OpenTelemetry observability. Published on npm as `@reaatech/*`.\n    *   \ud83c\udf1f [agent-to-agent-ts](https://github.com/A2A-tools/agent-to-agent-ts) by [@A2A-tools](https://github.com/A2A-tools) [![Stars](https://img.shields.io/github/stars/A2A-tools/agent-to-agent-ts?style=social)](https://github.com/A2A-tools/agent-to-agent-ts) - Practical TypeScript A2A implementation with gRPC-first transport, AgentCard discovery, task lifecycle management, JSON Schema validation, HTTP/WebSocket helpers, and a bundled CLI. Node 22+.\n*   **PHP**\n    *   \ud83c\udf1f [a2a-php](https://github.com/andreibesleaga/a2a-php) by [@andreibesleaga](https://github.com/andreibesleaga) [![Stars](https://img.shields.io/github/stars/andreibesleaga/a2a-php?style=social)](https://github.com/andreibesleaga/a2a-php) - PHP implementation of the A2A Protocol with a fully compliant reference server, strict JSON-RPC validation, task management, SSE streaming, push notifications, and 100% official TCK pass rate.\n*   **Java**\n    *   \ud83c\udf1f [a2a-java](https://github.com/a2aproject/a2a-java) by [@a2aproject](https://github.com/a2aproject) [![Stars](https://img.shields.io/github/stars/a2aproject/a2a-java?style=social)](https://github.com/a2aproject/a2a-java) - **Official** Java SDK for the Agent2Agent (A2A) Protocol.\n    *   \ud83c\udf1f [a2ajava](https://github.com/vishalmysore/a2ajava) by [@vishalmysore](https://github.com/vishalmysore) [![Stars](https://img.shields.io/github/stars/vishalmysore/a2ajava?style=social)](https://github.com/vishalmysore/a2ajava) - Java A2A server/client implementation using Spring Boot with annotations. Supports WebSockets, MCP integration, and includes enterprise/Kubernetes deployment tutorials.\n    *   \ud83c\udf1f [a2a4j](https://github.com/a2ap/a2a4j) by [@a2ap](https://github.com/a2ap) [![Stars](https://img.shields.io/github/stars/a2ap/a2a4j?style=social)](https://github.com/a2ap/a2a4j) - A2A4J is a comprehensive Java implementation of the Agent2Agent Protocol, including server, client, examples, and a starter \u2014 ready to use out of the box.\n    *   \ud83c\udf1f [spring-ai-a2a](https://github.com/spring-ai-community/spring-ai-a2a) by [@spring-ai-community](https://github.com/spring-ai-community) [![Stars](https://img.shields.io/github/stars/spring-ai-community/spring-ai-a2a?style=social)](https://github.com/spring-ai-community/spring-ai-a2a) - Spring Boot and Spring AI integration for building AI agent servers using the A2A Protocol. Features auto-configuration, full `@Tool` support, and multi-agent orchestration examples.\n    *   \ud83c\udf1f [rocketmq-a2a](https://github.com/apache/rocketmq-a2a) by [@apache](https://github.com/apache) [![Stars](https://img.shields.io/github/stars/apache/rocketmq-a2a?style=social)](https://github.com/apache/rocketmq-a2a) - Apache RocketMQ transport integration for the A2A Protocol.",
  "context": "README chunk 5"
}
