{
  "sha256": "667c6ed6c5848a7f83629745e184d0ee2fbf175b5941e68aa80e5169177b2ce3",
  "source_url": "https://github.com/m3talux/superbrain/blob/HEAD/README.md",
  "fetched_at": "2026-06-12T05:04:31Z",
  "fetcher": "smadp.autopilot.profile_enrich.v1",
  "media_type": "text/markdown",
  "quote": "\u2014 see [CONTRIBUTING.md](CONTRIBUTING.md).\n\n## Acknowledgements\n\nStanding on the shoulders of: Andrej Karpathy's *LLM Wiki* pattern, [claude-mem](https://github.com/thedotmack/claude-mem) (global-plugin distribution + context injection), [basic-memory](https://github.com/basicmachines-co/basic-memory) (Obsidian-native markdown memory), [obsidian-second-brain](https://github.com/eugeniughelbur/obsidian-second-brain) (AI-first note rules), and [claude-memory-compiler](https://github.com/coleam00/claude-memory-compiler) (session-triggered rollups).\n\n## License\n\n[MIT](LICENSE) \u00a9 m3talux\n",
  "context": "README chunk 3"
}
