{
  "sha256": "d6e5c9642e3d680a1eab6cfd4ee6ccc2b56b229d1d857a22449f5666326ec318",
  "source_url": "https://github.com/RealEstateWebTools/property_web_scraper/blob/HEAD/README.md",
  "fetched_at": "2026-06-11T08:25:57Z",
  "fetcher": "smadp.autopilot.profile_enrich.v1",
  "media_type": "text/markdown",
  "quote": "g can sometimes be used as a legitimate way to access all kinds of data on the internet, it's also important to consider the legal implications. There are cases where scraping data may be considered illegal, or open you to the possibility of being sued.\n\nThis tool was created in part as a learning exercise and is shared in case others find it useful. If you do decide to use this tool to scrape a website it is your responsibility to ensure that what you are doing is legal.\n",
  "context": "README chunk 2"
}
