{
  "sha256": "18147d707561bd8f1b3005271d118fb688321cb4ee87dd3b8b19ed2fa97c3834",
  "source_url": "https://github.com/tassiovale/claude-code-kit/blob/HEAD/README.md",
  "fetched_at": "2026-08-12T00:11:33Z",
  "fetcher": "smadp.autopilot.profile_enrich.v1",
  "media_type": "text/markdown",
  "quote": " [csharp-developer](agents/csharp-developer.md) | ASP.NET Core APIs and cloud-native .NET with clean architecture. |\n| [dotnet-core-expert](agents/dotnet-core-expert.md) | Cloud-native .NET Core microservices with minimal APIs. |\n| [dotnet-framework-4.8-expert](agents/dotnet-framework-4.8-expert.md) | Legacy .NET Framework 4.8 maintenance and modernization. |\n| [php-pro](agents/php-pro.md) | Modern PHP 8.3+ with strong typing and enterprise frameworks. |\n| [kotlin-specialist](agents/kotlin-specialist.md) | Kotlin coroutines, multiplatform, and Android development. |\n| [swift-expert](agents/swift-expert.md) | Native iOS/macOS/server-side Swift with advanced concurrency. |\n| [elixir-expert](agents/elixir-expert.md) | Fault-tolerant concurrent systems with OTP and Phoenix. |\n| [sql-pro](agents/sql-pro.md) | Complex SQL query optimization and schema design across major engines. |\n\n### Frameworks (Frontend / Backend / Mobile)\n\n| Agent | Description |\n| --- | --- |\n| [react-specialist](agents/react-specialist.md) | React 18+ patterns, performance optimization, and server components. |\n| [react-coder](agents/react-coder.md) | Simplicity-first React 19 components using internal UI packages. |\n| [vue-expert](agents/vue-expert.md) | Vue 3 Composition API, reactivity, and Nuxt 3 development. |\n| [angular-architect](agents/angular-architect.md) | Enterprise Angular 15+ with complex state and micro-frontends. |\n| [nextjs-developer](agents/nextjs-developer.md) | Production Next.js 14+ with App Router and server components. |\n| [frontend-developer](agents/frontend-developer.md) | Robust, scalable React frontend components and UX. |\n| [fullstack-developer](agents/fullstack-developer.md) | End-to-end feature delivery from database to UI. |\n| [backend-developer](agents/backend-developer.md) | Scalable API development and microservices. |\n| [django-developer](agents/django-developer.md) | Django 4+ apps and REST APIs with async views. |\n| [rails-expert](agents/rails-expert.md) | Rails apps with Hotwire reactivity and idiomatic patterns. |\n| [laravel-specialist](agents/laravel-specialist.md) | Laravel 10+ with Eloquent, queues, and enterprise features. |\n| [laravel-backend-expert](agents/laravel-backend-expert.md) | Laravel backend controllers, services, and Eloquent models. |\n| [laravel-eloquent-expert](agents/laravel-eloquent-expert.md) | Laravel Eloquent schemas, relationships, and query tuning. |\n| [spring-boot-engineer](agents/spring-boot-engineer.md) | Enterprise Spring Boot 3+ microservices and reactive patterns. |\n| [wordpress-master](agents/wordpress-master.md) | WordPress themes, plugins, headless APIs, and scaling. |\n| [mobile-developer](agents/mobile-developer.md) | Cross-platform mobile with React Native and Flutter. |\n| [mobile-app-developer](agents/mobile-app-developer.md) | Native and cross-platform iOS/Android development. |\n| [flutter-expert](agents/flutter-expert.md) | Cross-platform Flutter 3+ with custom UI and state management. |\n| [electron-pro](agents/electron-pro.md) | Electron desktop apps with native OS integration and distribution. |\n| [cli-developer](agents/cli-developer.md) | Command-line tools with intuitive design and cross-platform support. |\n\n### Architecture & API Design\n\n| Agent | Description |\n| --- | --- |\n| [architect-reviewer](agents/architect-reviewer.md) | System design validation, architectural patterns, and scalability analysis. |\n| [api-designer](agents/api-designer.md) | Scalable, developer-friendly REST and GraphQL API design. |\n| [graphql-architect](agents/graphql-architect.md) | GraphQL schema design, federation, and query performance. |\n| [microservices-architect](agents/microservices-architect.md) | Distributed microservice ecosystems and communication patterns. |\n| [websocket-engineer](agents/websocket-engineer.md) | Scalable real-time WebSocket architectures and low-latency messaging. |\n| [database-architect](agents/database-architect.md) | Data layer design, technology selection, and schema modeling. |\n\n### Data & Databases\n\n| Agent | Description |\n| --- | --- |\n| [database-administrator](agents/database-administrator.md) | High-availability DBs, performance tuning, and disaster recovery. |\n| [database-optimizer](agents/database-optimizer.md) | Query optimization, indexing, caching, and partitioning. |\n| [postgres-pro](agents/postgres-pro.md) | PostgreSQL performance, replication, and advanced features. |\n| [data-engineer](agents/data-engineer.md) | Scalable data pipelines, ETL/ELT, and data infrastructure. |\n| [data-analyst](agents/data-analyst.md) | Business data insights, dashboards, and statistical analysis. |\n| [data-scientist](agents/data-scientist.md) | Statistical analysis, ML, and data storytelling. |\n| [data-researcher](agents/data-researcher.md) | Discover, collect, and validate data from multiple sources. |\n\n### AI / ML\n\n| Agent | Description |\n| --- | --- |\n| [ai-engineer](agents/ai-engineer.md) | AI system design, model implementation, and production deployment. |\n| [ml-engineer](agents/ml-engineer.md) | Production ML training pipelines, serving, and retraining. |\n| [machine-learning-engineer](agents/machine-learning-engineer.md) | Model deployment, serving infrastructure, and edge inference. |\n| [mlops-engineer](agents/mlops-engineer.md) | ML infrastructure, CI/CD, versioning, and experiment tracking. |\n| [llm-architect](agents/llm-architect.md) | Production LLM systems, fine-tuning, RAG, and inference serving. |\n| [nlp-engineer](agents/nlp-engineer.md) | NLP/NLU/NLG with transformer models and production pipelines. |\n| [prompt-engineer](agents/prompt-engineer.md) | Design, optimize, and evaluate prompts for production LLMs. |\n| [mcp-developer](agents/mcp-developer.md) | Model Context Protocol server and client development. |\n\n### Infrastructure / DevOps / Cloud\n\n| Agent | Description |\n| --- | --- |\n| [cloud-architect](agents/cloud-architect.md) | Multi-cloud (AWS/Azure/GCP) IaC, FinOps, and architecture. |\n| [devops-engineer](agents/devops-engineer.md) | CI/CD, containerization, monitoring, and automation. |\n| [deployment-engineer](agents/deployment-engineer.md) | CI/CD pipelines and zero-downtime deployment strategies. |\n| [platform-engineer](agents/platform-engineer.md) | Internal developer platforms, golden paths, and self-service. |\n| [kubernetes-architect](agents/kubernetes-architect.md) | Cloud-native K8s, GitOps, service mesh, and multi-tenancy. |\n| [kubernetes-specialist](agents/kubernetes-specialist.md) | Production-grade K8s deployments and cluster management. |\n| [docker-expert](agents/docker-expert.md) | Container image building, optimization, and orchestration. |\n| [terraform-engineer](agents/terraform-engineer.md) | Multi-cloud Terraform IaC and state management. |\n| [terragrunt-expert](agents/terragrunt-expert.md) | Terragrunt orchestration and DRY multi-environment IaC. |\n| [azure-infra-engineer](agents/azure-infra-engineer.md) | Azure infrastructure, Entra ID, Bicep, and PowerShell automation. |\n| [network-engineer](agents/network-engineer.md) | Cloud/hybrid network design, security, and troubleshooting. |\n| [cost-optimizer](agents/cost-optimizer.md) | Cloud cost analysis, resource optimization, and scaling plans. |\n| [windows-infra-admin](agents/windows-infra-admin.md) | Windows Server, Active Directory, DNS, DHCP, and Group Policy. |\n| [iot-engineer](agents/iot-engineer.md) | Connected device architectures, edge computing, and IoT platforms. |\n\n### PowerShell / Windows Automation\n\n| Agent | Description |\n| --- | --- |\n| [powershell-5.1-expert](agents/powershell-5.1-expert.md) | PowerShell 5.1 Windows automation with RSAT modules. |\n| [powershell-7-expert](agents/powershell-7-expert.md) | Cross-platform PowerShell 7+ cloud automation and CI/CD. |\n| [powershell-module-architect](agents/powershell-module-architect.md) | PowerShell module architecture and reusable automation libraries. |\n| [powershell-security-hardening](agents/powershell-security-hardening.md) | Hardening PowerShell",
  "context": "README chunk 2"
}
